{
  "schema_version": "1.0.0",
  "matrix_version": "pattern-state-2026-07-11-v1",
  "state_catalog": ["default","loading","empty","error","success","focused","disabled","keyboard","destructive_confirmation","validation_error","permission_denied","offline"],
  "state_transitions": [
    {"from":"proposed","to":"approved"},
    {"from":"approved","to":"generated"},
    {"from":"generated","to":"build_verified"},
    {"from":"build_verified","to":"render_verified"},
    {"from":"render_verified","to":"published"}
  ],
  "entries": [
    {"ui_pattern":"splash-launch","states":[{"id":"default","applicability":"required"},{"id":"loading","applicability":"required"},{"id":"empty","applicability":"not_applicable"},{"id":"error","applicability":"required"},{"id":"success","applicability":"optional"},{"id":"focused","applicability":"not_applicable"},{"id":"disabled","applicability":"optional"},{"id":"keyboard","applicability":"not_applicable"},{"id":"destructive_confirmation","applicability":"not_applicable"},{"id":"validation_error","applicability":"not_applicable"},{"id":"permission_denied","applicability":"optional"},{"id":"offline","applicability":"optional"}]},
    {"ui_pattern":"onboarding-tutorial","states":[{"id":"default","applicability":"required"},{"id":"loading","applicability":"optional"},{"id":"empty","applicability":"not_applicable"},{"id":"error","applicability":"required"},{"id":"success","applicability":"required"},{"id":"focused","applicability":"optional"},{"id":"disabled","applicability":"optional"},{"id":"keyboard","applicability":"optional"},{"id":"destructive_confirmation","applicability":"not_applicable"},{"id":"validation_error","applicability":"optional"},{"id":"permission_denied","applicability":"optional"},{"id":"offline","applicability":"optional"}]},
    {"ui_pattern":"permissions","states":[{"id":"default","applicability":"required"},{"id":"loading","applicability":"optional"},{"id":"empty","applicability":"not_applicable"},{"id":"error","applicability":"required"},{"id":"success","applicability":"required"},{"id":"focused","applicability":"not_applicable"},{"id":"disabled","applicability":"optional"},{"id":"keyboard","applicability":"not_applicable"},{"id":"destructive_confirmation","applicability":"not_applicable"},{"id":"validation_error","applicability":"optional"},{"id":"permission_denied","applicability":"required"},{"id":"offline","applicability":"optional"}]},
    {"ui_pattern":"login-signup","states":[{"id":"default","applicability":"required"},{"id":"loading","applicability":"optional"},{"id":"empty","applicability":"not_applicable"},{"id":"error","applicability":"optional"},{"id":"success","applicability":"required"},{"id":"focused","applicability":"required"},{"id":"disabled","applicability":"optional"},{"id":"keyboard","applicability":"optional"},{"id":"destructive_confirmation","applicability":"not_applicable"},{"id":"validation_error","applicability":"required"},{"id":"permission_denied","applicability":"optional"},{"id":"offline","applicability":"optional"}]},
    {"ui_pattern":"home-dashboard","states":[{"id":"default","applicability":"required"},{"id":"loading","applicability":"required"},{"id":"empty","applicability":"optional"},{"id":"error","applicability":"required"},{"id":"success","applicability":"optional"},{"id":"focused","applicability":"optional"},{"id":"disabled","applicability":"optional"},{"id":"keyboard","applicability":"not_applicable"},{"id":"destructive_confirmation","applicability":"optional"},{"id":"validation_error","applicability":"not_applicable"},{"id":"permission_denied","applicability":"optional"},{"id":"offline","applicability":"optional"}]},
    {"ui_pattern":"bottom-tabs","states":[{"id":"default","applicability":"required"},{"id":"loading","applicability":"required"},{"id":"empty","applicability":"optional"},{"id":"error","applicability":"optional"},{"id":"success","applicability":"optional"},{"id":"focused","applicability":"optional"},{"id":"disabled","applicability":"optional"},{"id":"keyboard","applicability":"not_applicable"},{"id":"destructive_confirmation","applicability":"not_applicable"},{"id":"validation_error","applicability":"not_applicable"},{"id":"permission_denied","applicability":"optional"},{"id":"offline","applicability":"optional"}]},
    {"ui_pattern":"search-discovery","states":[{"id":"default","applicability":"required"},{"id":"loading","applicability":"required"},{"id":"empty","applicability":"required"},{"id":"error","applicability":"required"},{"id":"success","applicability":"optional"},{"id":"focused","applicability":"required"},{"id":"disabled","applicability":"optional"},{"id":"keyboard","applicability":"required"},{"id":"destructive_confirmation","applicability":"not_applicable"},{"id":"validation_error","applicability":"optional"},{"id":"permission_denied","applicability":"optional"},{"id":"offline","applicability":"optional"}]},
    {"ui_pattern":"filters-sorting","states":[{"id":"default","applicability":"required"},{"id":"loading","applicability":"optional"},{"id":"empty","applicability":"required"},{"id":"error","applicability":"optional"},{"id":"success","applicability":"required"},{"id":"focused","applicability":"required"},{"id":"disabled","applicability":"optional"},{"id":"keyboard","applicability":"optional"},{"id":"destructive_confirmation","applicability":"not_applicable"},{"id":"validation_error","applicability":"optional"},{"id":"permission_denied","applicability":"not_applicable"},{"id":"offline","applicability":"optional"}]},
    {"ui_pattern":"product-list","states":[{"id":"default","applicability":"required"},{"id":"loading","applicability":"required"},{"id":"empty","applicability":"required"},{"id":"error","applicability":"required"},{"id":"success","applicability":"optional"},{"id":"focused","applicability":"optional"},{"id":"disabled","applicability":"optional"},{"id":"keyboard","applicability":"not_applicable"},{"id":"destructive_confirmation","applicability":"optional"},{"id":"validation_error","applicability":"optional"},{"id":"permission_denied","applicability":"optional"},{"id":"offline","applicability":"optional"}]},
    {"ui_pattern":"product-detail","states":[{"id":"default","applicability":"required"},{"id":"loading","applicability":"required"},{"id":"empty","applicability":"optional"},{"id":"error","applicability":"required"},{"id":"success","applicability":"optional"},{"id":"focused","applicability":"optional"},{"id":"disabled","applicability":"optional"},{"id":"keyboard","applicability":"not_applicable"},{"id":"destructive_confirmation","applicability":"optional"},{"id":"validation_error","applicability":"optional"},{"id":"permission_denied","applicability":"optional"},{"id":"offline","applicability":"optional"}]},
    {"ui_pattern":"saved-items","states":[{"id":"default","applicability":"required"},{"id":"loading","applicability":"required"},{"id":"empty","applicability":"required"},{"id":"error","applicability":"required"},{"id":"success","applicability":"optional"},{"id":"focused","applicability":"optional"},{"id":"disabled","applicability":"optional"},{"id":"keyboard","applicability":"not_applicable"},{"id":"destructive_confirmation","applicability":"optional"},{"id":"validation_error","applicability":"optional"},{"id":"permission_denied","applicability":"not_applicable"},{"id":"offline","applicability":"optional"}]},
    {"ui_pattern":"cart-checkout","states":[{"id":"default","applicability":"required"},{"id":"loading","applicability":"required"},{"id":"empty","applicability":"required"},{"id":"error","applicability":"required"},{"id":"success","applicability":"required"},{"id":"focused","applicability":"required"},{"id":"disabled","applicability":"optional"},{"id":"keyboard","applicability":"required"},{"id":"destructive_confirmation","applicability":"required"},{"id":"validation_error","applicability":"required"},{"id":"permission_denied","applicability":"optional"},{"id":"offline","applicability":"optional"}]},
    {"ui_pattern":"payment-coupon","states":[{"id":"default","applicability":"required"},{"id":"loading","applicability":"required"},{"id":"empty","applicability":"optional"},{"id":"error","applicability":"required"},{"id":"success","applicability":"required"},{"id":"focused","applicability":"required"},{"id":"disabled","applicability":"optional"},{"id":"keyboard","applicability":"required"},{"id":"destructive_confirmation","applicability":"required"},{"id":"validation_error","applicability":"required"},{"id":"permission_denied","applicability":"optional"},{"id":"offline","applicability":"optional"}]},
    {"ui_pattern":"account-wallet","states":[{"id":"default","applicability":"required"},{"id":"loading","applicability":"required"},{"id":"empty","applicability":"optional"},{"id":"error","applicability":"required"},{"id":"success","applicability":"required"},{"id":"focused","applicability":"optional"},{"id":"disabled","applicability":"optional"},{"id":"keyboard","applicability":"not_applicable"},{"id":"destructive_confirmation","applicability":"optional"},{"id":"validation_error","applicability":"optional"},{"id":"permission_denied","applicability":"optional"},{"id":"offline","applicability":"optional"}]},
    {"ui_pattern":"transaction-history","states":[{"id":"default","applicability":"required"},{"id":"loading","applicability":"required"},{"id":"empty","applicability":"required"},{"id":"error","applicability":"required"},{"id":"success","applicability":"optional"},{"id":"focused","applicability":"optional"},{"id":"disabled","applicability":"optional"},{"id":"keyboard","applicability":"not_applicable"},{"id":"destructive_confirmation","applicability":"optional"},{"id":"validation_error","applicability":"not_applicable"},{"id":"permission_denied","applicability":"optional"},{"id":"offline","applicability":"optional"}]},